{
  "aggregates": {
    "coldLoadSeconds": {
      "count": 5,
      "maximum": 1.5206271,
      "p50": 1.4598556,
      "p95": 1.5206271
    },
    "sustainedGeneratedDurationSeconds": 198.35646258503402,
    "sustainedRtf": {
      "count": 24,
      "maximum": 0.03851859375,
      "p50": 0.021631351102941176,
      "p95": 0.03603414204703752
    },
    "totalSustainedRtf": 0.02511192544515474,
    "warmFirstAudioSeconds": {
      "count": 16,
      "maximum": 0.4135505,
      "p50": 0.1845593,
      "p95": 0.4135505
    },
    "warmRtf": {
      "count": 16,
      "maximum": 0.052432513614430146,
      "p50": 0.02260447534635043,
      "p95": 0.052432513614430146
    },
    "warmShorterCompleteSeconds": {
      "count": 16,
      "maximum": 0.4139434,
      "p50": 0.1850545,
      "p95": 0.4139434
    },
    "warmTimeTo15SecondsMediaSeconds": "unavailable"
  },
  "artifacts": [
    {
      "artifactId": "piper-model",
      "revision": "piper-voices-0d907f1",
      "sha256": "6658b03b1a6c316ee4c265a9896abc1393353c2d9e1bca7d66c2c442e222a917",
      "sizeBytes": 63201294
    },
    {
      "artifactId": "piper-config",
      "revision": "piper-voices-0d907f1",
      "sha256": "0e0dda87c732f6f38771ff274a6380d9252f327dca77aa2963d5fbdf9ec54842",
      "sizeBytes": 4817
    },
    {
      "artifactId": "piper-model-card",
      "revision": "piper-voices-0d907f1",
      "sha256": "420703b5d8ea239b729f13d83f31eea9bae5fcb89447de23ebc94aa8a4768f95",
      "sizeBytes": 276
    }
  ],
  "audits": {
    "artifacts": {
      "status": "pass",
      "violations": 0
    },
    "license": {
      "reviewId": "piper-gpl3-cc0-v6",
      "status": "pass"
    },
    "offline": {
      "status": "pass",
      "violations": 0
    },
    "privacy": {
      "status": "pass",
      "violations": 0
    }
  },
  "authorityCommitSha": "9a2f74845853e84635b419a4e65170c9a2c207ee",
  "cancellation": [
    {
      "cleanupSeconds": 0.0,
      "rawSessionRemoved": true,
      "staleFrames": 0,
      "stopMode": "worker-termination",
      "stopSeconds": 0.2024541,
      "trialId": "before-dispatch"
    },
    {
      "cleanupSeconds": 0.0,
      "rawSessionRemoved": true,
      "staleFrames": 0,
      "stopMode": "worker-termination",
      "stopSeconds": 0.2284832,
      "trialId": "accepted-before-audio"
    },
    {
      "cleanupSeconds": 0.0,
      "rawSessionRemoved": true,
      "staleFrames": 0,
      "stopMode": "worker-termination",
      "stopSeconds": 0.1917295,
      "trialId": "after-first-audio"
    },
    {
      "cleanupSeconds": 0.0,
      "rawSessionRemoved": true,
      "staleFrames": 0,
      "stopMode": "worker-termination",
      "stopSeconds": 0.1781399,
      "trialId": "after-five-media-seconds"
    },
    {
      "cleanupSeconds": 0.0,
      "rawSessionRemoved": true,
      "staleFrames": 0,
      "stopMode": "worker-termination",
      "stopSeconds": 0.1972723,
      "trialId": "near-hard-mid-generation"
    }
  ],
  "candidateId": "piper-1-4-2-onnx-cpu-es-es-davefx-medium-v1",
  "candidateLockSha256": "542bf0064d80b20b9cfe599b0ac0a39488d25dbfb73a50e65aac1985c643cd82",
  "candidateManifestVersion": "tts-candidate-manifest-v6",
  "configurationIdentitySha256": "9e9b1a93aed70cfdbdd8dd8141d2a7edb363530372387d7596bb4ef8d46bd918",
  "corpusSha256": "0e1c997bbd9858969ddc36e0a097f7d5a019a94bc16fcf99af9fe1e0b1577def",
  "corpusVersion": "tts-cpu-fallback-corpus-v6",
  "counts": {
    "cancellationTrials": 5,
    "coldLoads": 5,
    "failedObservations": 0,
    "sustainedGenerations": 24,
    "warmGenerations": 16
  },
  "executionCommitSha": "d9f2929be40e40b2fa85078816ea854fad9a6c69",
  "gateEvaluation": {
    "failedGates": [],
    "outcome": "pass"
  },
  "generationObservations": [
    {
      "caseId": "es-v6-arrival",
      "firstAudioSeconds": 0.4135505,
      "generatedDurationSeconds": 7.894784580498866,
      "phase": "warm",
      "rtf": 0.052432513614430146,
      "sampleCount": 174080,
      "sampleRateHz": 22050,
      "timeTo15SecondsMedia": "shorter-complete",
      "wallSeconds": 0.4139434
    },
    {
      "caseId": "es-v6-dialogue",
      "firstAudioSeconds": 0.2258885,
      "generatedDurationSeconds": 8.70748299319728,
      "phase": "warm",
      "rtf": 0.0260463328125,
      "sampleCount": 192000,
      "sampleRateHz": 22050,
      "timeTo15SecondsMedia": "shorter-complete",
      "wallSeconds": 0.226798
    },
    {
      "caseId": "es-v6-numbers",
      "firstAudioSeconds": 0.3279939,
      "generatedDurationSeconds": 9.206712018140589,
      "phase": "warm",
      "rtf": 0.035680175436436,
      "sampleCount": 203008,
      "sampleRateHz": 22050,
      "timeTo15SecondsMedia": "shorter-complete",
      "wallSeconds": 0.3284971
    },
    {
      "caseId": "es-v6-date-time",
      "firstAudioSeconds": 0.3249877,
      "generatedDurationSeconds": 9.32281179138322,
      "phase": "warm",
      "rtf": 0.03490484494181974,
      "sampleCount": 205568,
      "sampleRateHz": 22050,
      "timeTo15SecondsMedia": "shorter-complete",
      "wallSeconds": 0.3254113
    },
    {
      "caseId": "es-v6-temperature",
      "firstAudioSeconds": 0.2177197,
      "generatedDurationSeconds": 8.661043083900227,
      "phase": "warm",
      "rtf": 0.025181735951114278,
      "sampleCount": 190976,
      "sampleRateHz": 22050,
      "timeTo15SecondsMedia": "shorter-complete",
      "wallSeconds": 0.2181001
    },
    {
      "caseId": "es-v6-foreign-name",
      "firstAudioSeconds": 0.1994706,
      "generatedDurationSeconds": 6.884716553287982,
      "phase": "warm",
      "rtf": 0.02902346065424747,
      "sampleCount": 151808,
      "sampleRateHz": 22050,
      "timeTo15SecondsMedia": "shorter-complete",
      "wallSeconds": 0.1998183
    },
    {
      "caseId": "es-v6-route",
      "firstAudioSeconds": 0.1782463,
      "generatedDurationSeconds": 8.034104308390022,
      "phase": "warm",
      "rtf": 0.02230471414378613,
      "sampleCount": 177152,
      "sampleRateHz": 22050,
      "timeTo15SecondsMedia": "shorter-complete",
      "wallSeconds": 0.1791984
    },
    {
      "caseId": "es-v6-closing",
      "firstAudioSeconds": 0.1825302,
      "generatedDurationSeconds": 8.092154195011338,
      "phase": "warm",
      "rtf": 0.02260447534635043,
      "sampleCount": 178432,
      "sampleRateHz": 22050,
      "timeTo15SecondsMedia": "shorter-complete",
      "wallSeconds": 0.1829189
    },
    {
      "caseId": "es-v6-arrival",
      "firstAudioSeconds": 0.1679758,
      "generatedDurationSeconds": 7.859954648526077,
      "phase": "warm",
      "rtf": 0.021416192271741137,
      "sampleCount": 173312,
      "sampleRateHz": 22050,
      "timeTo15SecondsMedia": "shorter-complete",
      "wallSeconds": 0.1683303
    },
    {
      "caseId": "es-v6-dialogue",
      "firstAudioSeconds": 0.1954593,
      "generatedDurationSeconds": 8.579773242630386,
      "phase": "warm",
      "rtf": 0.022848878922107577,
      "sampleCount": 189184,
      "sampleRateHz": 22050,
      "timeTo15SecondsMedia": "shorter-complete",
      "wallSeconds": 0.1960382
    },
    {
      "caseId": "es-v6-numbers",
      "firstAudioSeconds": 0.1845593,
      "generatedDurationSeconds": 9.113832199546485,
      "phase": "warm",
      "rtf": 0.020304795606090765,
      "sampleCount": 200960,
      "sampleRateHz": 22050,
      "timeTo15SecondsMedia": "shorter-complete",
      "wallSeconds": 0.1850545
    },
    {
      "caseId": "es-v6-date-time",
      "firstAudioSeconds": 0.1818492,
      "generatedDurationSeconds": 9.229931972789116,
      "phase": "warm",
      "rtf": 0.019752160745872643,
      "sampleCount": 203520,
      "sampleRateHz": 22050,
      "timeTo15SecondsMedia": "shorter-complete",
      "wallSeconds": 0.1823111
    },
    {
      "caseId": "es-v6-temperature",
      "firstAudioSeconds": 0.1864359,
      "generatedDurationSeconds": 8.498503401360544,
      "phase": "warm",
      "rtf": 0.021982517530097338,
      "sampleCount": 187392,
      "sampleRateHz": 22050,
      "timeTo15SecondsMedia": "shorter-complete",
      "wallSeconds": 0.1868185
    },
    {
      "caseId": "es-v6-foreign-name",
      "firstAudioSeconds": 0.1677196,
      "generatedDurationSeconds": 6.931156462585034,
      "phase": "warm",
      "rtf": 0.024243270355684673,
      "sampleCount": 152832,
      "sampleRateHz": 22050,
      "timeTo15SecondsMedia": "shorter-complete",
      "wallSeconds": 0.1680339
    },
    {
      "caseId": "es-v6-route",
      "firstAudioSeconds": 0.1608665,
      "generatedDurationSeconds": 7.952834467120182,
      "phase": "warm",
      "rtf": 0.020272507955063867,
      "sampleCount": 175360,
      "sampleRateHz": 22050,
      "timeTo15SecondsMedia": "shorter-complete",
      "wallSeconds": 0.1612239
    },
    {
      "caseId": "es-v6-closing",
      "firstAudioSeconds": 0.1691844,
      "generatedDurationSeconds": 8.080544217687075,
      "phase": "warm",
      "rtf": 0.02098582662648168,
      "sampleCount": 178176,
      "sampleRateHz": 22050,
      "timeTo15SecondsMedia": "shorter-complete",
      "wallSeconds": 0.1695769
    },
    {
      "caseId": "es-v6-route",
      "firstAudioSeconds": 0.157934,
      "generatedDurationSeconds": 7.918004535147392,
      "phase": "sustained",
      "rtf": 0.019991627852364368,
      "sampleCount": 174592,
      "sampleRateHz": 22050,
      "timeTo15SecondsMedia": "shorter-complete",
      "wallSeconds": 0.1582938
    },
    {
      "caseId": "es-v6-dialogue",
      "firstAudioSeconds": 0.1587684,
      "generatedDurationSeconds": 8.486893424036282,
      "phase": "sustained",
      "rtf": 0.018779062259533175,
      "sampleCount": 187136,
      "sampleRateHz": 22050,
      "timeTo15SecondsMedia": "shorter-complete",
      "wallSeconds": 0.1593759
    },
    {
      "caseId": "es-v6-numbers",
      "firstAudioSeconds": 0.1784941,
      "generatedDurationSeconds": 9.079002267573696,
      "phase": "sustained",
      "rtf": 0.019704026359694694,
      "sampleCount": 200192,